name,dosage,duration,instructions,category,description
Tab. Empagliflozin 10mg,1-0-0,Long term,Morning,SGLT2 Inhibitor,"SGLT2 inhibitor lowering glucose via renal excretion; benefits on heart failure and renal outcomes in some patients but risk of genital infections and euglycemic ketoacidosis in certain settings."
Tab. Dapagliflozin 10mg,1-0-0,Long term,Morning,SGLT2 Inhibitor,"SGLT2 inhibitor used in diabetes and heart failure settings; monitor renal function and educate on genital hygiene to reduce infections."
Tab. Liraglutide 0.6mg,Once daily,Long term,SC injection,GLP-1 Agonist,"GLP-1 receptor agonist improving glycemic control and often reducing weight; injection therapy with GI side effects common initially."
Tab. Semaglutide 0.25mg,Once weekly,Long term,SC injection,GLP-1 Agonist,"Long-acting GLP-1 receptor agonist administered weekly for diabetes and some indications for weight management; monitor for GI adverse effects."
Tab. Omeprazole IV 40mg,1 dose/day,As per indication,IV infusion,Antacid/PPI,"IV PPI used when oral route unavailable for acid suppression—used in GI bleeding or perioperative settings."
Tab. Azathioprine (additional) 50mg,1-0-1,Long term,After food,Immunosuppressant,"Used in autoimmune conditions; metabolized variably—consider testing for TPMT activity to reduce hematologic toxicity risk."
Tab. Mycophenolate Sodium 500mg,1-0-1,Long term,After food,Immunosuppressant,"Alternative formulation of mycophenolate with similar immunosuppressive effects and monitoring needs."
Tab. Prednisone 5mg,1-0-0,Short course,After food,Steroid,"Oral glucocorticoid used widely for inflammatory conditions with dose and duration determining adverse effect profile—taper when stopping prolonged therapy."
Tab. Benzoyl Peroxide 5% Gel,Apply OD,As needed,Topical application,Topical Acne Agent,"Topical agent for acne with antibacterial and keratolytic properties; may cause local irritation and bleaching of fabrics."
Tab. Isotretinoin 10mg,1-0-0,Variable,With food,Oral Retinoid,"Powerful systemic acne therapy with teratogenicity risks and multiple monitoring requirements; reserved for severe nodulocystic acne under specialist supervision."
Tab. Sildenafil 50mg,1-0-0,As needed,30-60 mins before sex,ED Agent,"PDE5 inhibitor for erectile dysfunction; contraindicated with nitrates and caution with cardiovascular disease."
Tab. Tamsulosin 0.4mg,1-0-0,Long term,After food,BPH Agent,"Alpha-1 blocker used to improve urinary flow in benign prostatic hyperplasia; may cause postural hypotension and ejaculatory disturbance."
Tab. Finasteride 5mg,1-0-0,Long term,Once daily,BPH/Androgenic Alopecia Agent,"5-alpha reductase inhibitor that reduces prostate volume and male-pattern hair loss; sexual adverse effects and teratogenic—avoid in women of childbearing potential."
Tab. Omalizumab 150-300mg,Every 2-4 weeks,Long term,SC injection,Biologic Anti-IgE,"Monoclonal antibody for severe allergic asthma and chronic urticaria; administered by specialist with monitoring for injection reactions."
Tab. Denosumab 60mg,Every 6 months,Long term,SC injection,Bone Metabolism Agent,"RANKL inhibitor used to reduce fracture risk in osteoporosis; dental evaluation advised before starting due to osteonecrosis risk."
Tab. Levothyroxine (additional) 100mcg,1-0-0,Long term,Empty stomach,Thyroid Hormone,"Standard replacement dose in hypothyroidism—dose individualized to TSH and clinical response."
